{
  "$schema": "https://raw.githubusercontent.com/microsoft/botbuilder-dotnet/gabog/SkillsSecondPass/prototypes/SkillManifest.schema-1-0-0.json",
  "$id": "EchoSkill",
  "name": "Echo skill",
  "version": "1.0",
  "description": "This skill echoes whatever the user says",
  "publisherName": "Microsoft",
  "privacyUrl": "https://myskill.com/privacy.html",
  "copyright": "Copyright (c) Microsoft Corporation. All rights reserved.",
  "license": "",
  "iconUrl": "https://myskill.com/icon.png",
  "tags": [
    "sample",
    "echo"
  ],
  "endpoints": {
    "production": {
      "protocol": "BotFrameworkV3",
      "description": "Production  endpoint for SkillBot.",
      "endpointUrl": "http://contoso.com/api/messages",
      "msAppId": "a0000f00-Ad00-a000-a000-a0000aaaAaa0"
    }
  },
  "language": {
    "intents": {
      "echo": "#/activities/message"
    }
  },
  "activities": {
    "message": {
      "type": "message",
      "description": "A message activity containing the utterance that the skill will echo back to the user"
    }
  }
}